{
	"$schema": "./static/schema/registry.json",
	"name": "shadcn-svelte",
	"homepage": "https://shadcn-svelte.com",
	"overrideDependencies": ["vaul-svelte@next"],
	"aliases": {
		"lib": "$lib/registry/lib",
		"ui": "$lib/registry/ui",
		"components": "./components",
		"utils": "$lib/utils",
		"hooks": "$lib/registry/hooks"
	},
	"items": [
		{
			"name": "init",
			"type": "registry:style",
			"devDependencies": ["tailwind-variants", "tw-animate-css"],
			"registryDependencies": ["utils"],
			"files": []
		},
		{
			"name": "accordion",
			"type": "registry:ui",
			"registryDependencies": [],
			"files": [
				{
					"type": "registry:file",
					"path": "src/lib/registry/ui/accordion/accordion-content.svelte"
				},
				{
					"type": "registry:file",
					"path": "src/lib/registry/ui/accordion/accordion-item.svelte"
				},
				{
					"type": "registry:file",
					"path": "src/lib/registry/ui/accordion/accordion-trigger.svelte"
				},
				{
					"type": "registry:file",
					"path": "src/lib/registry/ui/accordion/accordion.svelte"
				},
				{
					"type": "registry:file",
					"path": "src/lib/registry/ui/accordion/index.ts"
				}
			]
		},
		{
			"name": "alert",
			"type": "registry:ui",
			"registryDependencies": [],
			"files": [
				{
					"type": "registry:file",
					"path": "src/lib/registry/ui/alert/alert-action.svelte"
				},
				{
					"type": "registry:file",
					"path": "src/lib/registry/ui/alert/alert-description.svelte"
				},
				{
					"type": "registry:file",
					"path": "src/lib/registry/ui/alert/alert-title.svelte"
				},
				{
					"type": "registry:file",
					"path": "src/lib/registry/ui/alert/alert.svelte"
				},
				{
					"type": "registry:file",
					"path": "src/lib/registry/ui/alert/index.ts"
				}
			]
		},
		{
			"name": "alert-dialog",
			"type": "registry:ui",
			"registryDependencies": ["button"],
			"files": [
				{
					"type": "registry:file",
					"path": "src/lib/registry/ui/alert-dialog/alert-dialog-action.svelte"
				},
				{
					"type": "registry:file",
					"path": "src/lib/registry/ui/alert-dialog/alert-dialog-cancel.svelte"
				},
				{
					"type": "registry:file",
					"path": "src/lib/registry/ui/alert-dialog/alert-dialog-content.svelte"
				},
				{
					"type": "registry:file",
					"path": "src/lib/registry/ui/alert-dialog/alert-dialog-description.svelte"
				},
				{
					"type": "registry:file",
					"path": "src/lib/registry/ui/alert-dialog/alert-dialog-footer.svelte"
				},
				{
					"type": "registry:file",
					"path": "src/lib/registry/ui/alert-dialog/alert-dialog-header.svelte"
				},
				{
					"type": "registry:file",
					"path": "src/lib/registry/ui/alert-dialog/alert-dialog-media.svelte"
				},
				{
					"type": "registry:file",
					"path": "src/lib/registry/ui/alert-dialog/alert-dialog-overlay.svelte"
				},
				{
					"type": "registry:file",
					"path": "src/lib/registry/ui/alert-dialog/alert-dialog-portal.svelte"
				},
				{
					"type": "registry:file",
					"path": "src/lib/registry/ui/alert-dialog/alert-dialog-title.svelte"
				},
				{
					"type": "registry:file",
					"path": "src/lib/registry/ui/alert-dialog/alert-dialog-trigger.svelte"
				},
				{
					"type": "registry:file",
					"path": "src/lib/registry/ui/alert-dialog/alert-dialog.svelte"
				},
				{
					"type": "registry:file",
					"path": "src/lib/registry/ui/alert-dialog/index.ts"
				}
			]
		},
		{
			"name": "aspect-ratio",
			"type": "registry:ui",
			"registryDependencies": [],
			"files": [
				{
					"type": "registry:file",
					"path": "src/lib/registry/ui/aspect-ratio/aspect-ratio.svelte"
				},
				{
					"type": "registry:file",
					"path": "src/lib/registry/ui/aspect-ratio/index.ts"
				}
			]
		},
		{
			"name": "avatar",
			"type": "registry:ui",
			"registryDependencies": [],
			"files": [
				{
					"type": "registry:file",
					"path": "src/lib/registry/ui/avatar/avatar-badge.svelte"
				},
				{
					"type": "registry:file",
					"path": "src/lib/registry/ui/avatar/avatar-fallback.svelte"
				},
				{
					"type": "registry:file",
					"path": "src/lib/registry/ui/avatar/avatar-group-count.svelte"
				},
				{
					"type": "registry:file",
					"path": "src/lib/registry/ui/avatar/avatar-group.svelte"
				},
				{
					"type": "registry:file",
					"path": "src/lib/registry/ui/avatar/avatar-image.svelte"
				},
				{
					"type": "registry:file",
					"path": "src/lib/registry/ui/avatar/avatar.svelte"
				},
				{
					"type": "registry:file",
					"path": "src/lib/registry/ui/avatar/index.ts"
				}
			]
		},
		{
			"name": "badge",
			"type": "registry:ui",
			"registryDependencies": [],
			"files": [
				{
					"type": "registry:file",
					"path": "src/lib/registry/ui/badge/badge.svelte"
				},
				{
					"type": "registry:file",
					"path": "src/lib/registry/ui/badge/index.ts"
				}
			]
		},
		{
			"name": "breadcrumb",
			"type": "registry:ui",
			"registryDependencies": [],
			"files": [
				{
					"type": "registry:file",
					"path": "src/lib/registry/ui/breadcrumb/breadcrumb-ellipsis.svelte"
				},
				{
					"type": "registry:file",
					"path": "src/lib/registry/ui/breadcrumb/breadcrumb-item.svelte"
				},
				{
					"type": "registry:file",
					"path": "src/lib/registry/ui/breadcrumb/breadcrumb-link.svelte"
				},
				{
					"type": "registry:file",
					"path": "src/lib/registry/ui/breadcrumb/breadcrumb-list.svelte"
				},
				{
					"type": "registry:file",
					"path": "src/lib/registry/ui/breadcrumb/breadcrumb-page.svelte"
				},
				{
					"type": "registry:file",
					"path": "src/lib/registry/ui/breadcrumb/breadcrumb-separator.svelte"
				},
				{
					"type": "registry:file",
					"path": "src/lib/registry/ui/breadcrumb/breadcrumb.svelte"
				},
				{
					"type": "registry:file",
					"path": "src/lib/registry/ui/breadcrumb/index.ts"
				}
			]
		},
		{
			"name": "button",
			"type": "registry:ui",
			"registryDependencies": [],
			"files": [
				{
					"type": "registry:file",
					"path": "src/lib/registry/ui/button/button.svelte"
				},
				{
					"type": "registry:file",
					"path": "src/lib/registry/ui/button/index.ts"
				}
			]
		},
		{
			"name": "button-group",
			"type": "registry:ui",
			"registryDependencies": ["separator"],
			"files": [
				{
					"type": "registry:file",
					"path": "src/lib/registry/ui/button-group/button-group-separator.svelte"
				},
				{
					"type": "registry:file",
					"path": "src/lib/registry/ui/button-group/button-group-text.svelte"
				},
				{
					"type": "registry:file",
					"path": "src/lib/registry/ui/button-group/button-group.svelte"
				},
				{
					"type": "registry:file",
					"path": "src/lib/registry/ui/button-group/index.ts"
				}
			]
		},
		{
			"name": "calendar",
			"type": "registry:ui",
			"registryDependencies": ["button"],
			"files": [
				{
					"type": "registry:file",
					"path": "src/lib/registry/ui/calendar/calendar-caption.svelte"
				},
				{
					"type": "registry:file",
					"path": "src/lib/registry/ui/calendar/calendar-cell.svelte"
				},
				{
					"type": "registry:file",
					"path": "src/lib/registry/ui/calendar/calendar-day.svelte"
				},
				{
					"type": "registry:file",
					"path": "src/lib/registry/ui/calendar/calendar-grid-body.svelte"
				},
				{
					"type": "registry:file",
					"path": "src/lib/registry/ui/calendar/calendar-grid-head.svelte"
				},
				{
					"type": "registry:file",
					"path": "src/lib/registry/ui/calendar/calendar-grid-row.svelte"
				},
				{
					"type": "registry:file",
					"path": "src/lib/registry/ui/calendar/calendar-grid.svelte"
				},
				{
					"type": "registry:file",
					"path": "src/lib/registry/ui/calendar/calendar-head-cell.svelte"
				},
				{
					"type": "registry:file",
					"path": "src/lib/registry/ui/calendar/calendar-header.svelte"
				},
				{
					"type": "registry:file",
					"path": "src/lib/registry/ui/calendar/calendar-heading.svelte"
				},
				{
					"type": "registry:file",
					"path": "src/lib/registry/ui/calendar/calendar-month-select.svelte"
				},
				{
					"type": "registry:file",
					"path": "src/lib/registry/ui/calendar/calendar-month.svelte"
				},
				{
					"type": "registry:file",
					"path": "src/lib/registry/ui/calendar/calendar-months.svelte"
				},
				{
					"type": "registry:file",
					"path": "src/lib/registry/ui/calendar/calendar-nav.svelte"
				},
				{
					"type": "registry:file",
					"path": "src/lib/registry/ui/calendar/calendar-next-button.svelte"
				},
				{
					"type": "registry:file",
					"path": "src/lib/registry/ui/calendar/calendar-prev-button.svelte"
				},
				{
					"type": "registry:file",
					"path": "src/lib/registry/ui/calendar/calendar-year-select.svelte"
				},
				{
					"type": "registry:file",
					"path": "src/lib/registry/ui/calendar/calendar.svelte"
				},
				{
					"type": "registry:file",
					"path": "src/lib/registry/ui/calendar/index.ts"
				}
			]
		},
		{
			"name": "card",
			"type": "registry:ui",
			"registryDependencies": [],
			"files": [
				{
					"type": "registry:file",
					"path": "src/lib/registry/ui/card/card-action.svelte"
				},
				{
					"type": "registry:file",
					"path": "src/lib/registry/ui/card/card-content.svelte"
				},
				{
					"type": "registry:file",
					"path": "src/lib/registry/ui/card/card-description.svelte"
				},
				{
					"type": "registry:file",
					"path": "src/lib/registry/ui/card/card-footer.svelte"
				},
				{
					"type": "registry:file",
					"path": "src/lib/registry/ui/card/card-header.svelte"
				},
				{
					"type": "registry:file",
					"path": "src/lib/registry/ui/card/card-title.svelte"
				},
				{
					"type": "registry:file",
					"path": "src/lib/registry/ui/card/card.svelte"
				},
				{
					"type": "registry:file",
					"path": "src/lib/registry/ui/card/index.ts"
				}
			]
		},
		{
			"name": "carousel",
			"type": "registry:ui",
			"registryDependencies": ["button"],
			"files": [
				{
					"type": "registry:file",